id,text,len tweet,likes,rt,position
1271216405061537792,Sony anunció el jueves sobre qué juegos estarán disponibles para jugar en su próxima consola PlayStation 5 de últim… ,140,265,65,0
1271149640583458816,"¿Sanar traumas y heridas del pasado a través de la meditación? Hoy en nuestro #EncuentroDigitalCNN, @ArduinoCNN con… ",140,52,13,0
1271097370269429762,Nuevo medicamento contra el covid-19 da esperanzas a pacientes en EE. UU.. Mira esta y otras noticias claves para h… ,140,88,50,0
1271053830155894785,"RT @MexOpina: .@lopezobrador_  teme perder las elecciones y por eso el Gobierno creó el falso ‘Proyecto BOA’,  asegura @JorgeGCastaneda 👉 h…",140,0,26,0
1271025644995051521,Se han registrado al menos tres informes de actos vandálicos contra estatuas de Cristóbal Colón en Estados Unidos:… ,139,186,66,0
1270997972503924744,"La Organización Panamericana de la Salud advirtió esta semana que el virus todavía se estaba propagando ""agresivame… ",140,49,42,0
1270979356232503296,Seis de las primeras 10 ciudades de este año se encuentran en Asia ,90,35,16,0
