id,text,len tweet,likes,rt,position
1258208647743713281,Los picapleitos internos y los amarra navajas externos pretenden socavar la unión histórica de la 4T. Las posicione… https://t.co/EdUKhYQdsS,140,1954,494,0
1254056209424044032,"El petróleo: historia viva

La desastrosa herencia que recibió López Obrador se originó hace cuarenta años de gobie… https://t.co/Yf6DEYle0A",140,1305,530,0
1249339481062285312,AMLO está colocado en el centro del conflicto. Esperamos la primera decisión mundial de su gobierno. 7/7,104,247,68,0
1249339478977794050,"El presidente López Obrador anunció ayer que había sostenido una llamada con Donald Trump, quien le ha ofrecido cub… https://t.co/pWHHSqejlc",140,78,26,0
1249166758935777280,"AMLO está colocado en el centro de las decisiones, esperamos la primera decisión mundial de su gobierno. (7/7)",110,3073,670,0
1249166756624699393,El presidente López Obrador anunció ayer que había sostenido una llamada con Donald Trump y que este le ha ofrecido… https://t.co/xRiFjoWYZg,140,1169,293,0
