id,text,len tweet,likes,rt,postura
1121460625635409922,"I share with you the Second Report of the Inter-American Dialogue’s Venezuela Working Group which I am part of, abo… https://t.co/lx72ncwIOE",140,11,2,1
1121460393652707329,Les comparto el Segundo Informe del Grupo de Trabajo sobre Venezuela del Inter-American Dialogue @The_Dialogue del… https://t.co/8vHWe9P3BU,139,17,3,1
1121070898876837888,Hoy en la Reunión de Trabajo de Presidentes de Comisiones del @senadomexicano comenté sobre la importancia de no em… https://t.co/DiTQbVCJHw,140,98,17,1
1120446158956924928,"Más bien no hay palabras estimado @frubli Una tragedia q la violencia y el crimen vayan en aumento,en vez de dismin… https://t.co/EhH1svvTBT",140,48,15,-1
1114266742677745665,Felicito a David Malpass por haber sido electo por unanimidad como el 13vo Presidente del @BancoMundial @WorldBank.… https://t.co/T0W3vFQQWg,140,37,5,1
1100217763572957188,Es verdaderamente lamentable lo sucedido en Venezuela al periodista @jorgeramosnews y a su equipo de producción de… https://t.co/deesRnuCUf,139,277,76,-1
1099040500013768704,RT @The_Dialogue: The Dialogue’s Venezuela Working Group calls for peaceful democratic transition and unhindered entry of humanitarian aid…,139,0,15,1
1098415148832903168,Hoy en la reunión de la Comisión de Turismo del @senadomexicano me uní a la iniciativa del Senador Presidente… https://t.co/eGmVXyqFB8,134,424,114,1
