id,text,len tweet,likes,rt,position
1271470123614756866,"Yes, Your Grace is now available for Digital Pre-order and Pre-download on Xbox One. Save 15% - limited time offer https://t.co/1PiLJoZhxE",138,92,12,0
1271468038785658880,Radical Rabbit Stew is now available for Digital Pre-order and Pre-download on Xbox One https://t.co/QvrEby95i3,111,72,10,0
1271464754582712320,Goosebumps Dead Of Night is now available for Xbox One https://t.co/NKt7GrNIyB https://t.co/uo8I9rKTXo,102,110,11,0
1271306204170424326,Super Soccer Blast is now available for Xbox One https://t.co/MQb5njtYgR https://t.co/mln5fymqsT,96,163,19,0
1271303923781955584,Spacejacked from @RottenMage and @RatalaikaGames is now available for Xbox One. Save 20% - limited time offer https://t.co/5MzH40g9js,133,97,16,0
1271302967195398144,Project Warlock is now available for Xbox One https://t.co/gsJOhbBYL3,69,278,36,0
1271300508616032257,Horde Of Plenty is now available for Xbox One https://t.co/Tjd5ImSJCw https://t.co/Nh8FY8CwgL,93,116,15,0
1271300038367432704,"The Jackbox Party Trilogy 2.0 (@jackboxgames) is now available for Xbox One, includes all the games from The Jackbo… https://t.co/e6ZxG0NGJQ",140,90,12,0
1271297613279531009,Warborn is now available for Xbox One https://t.co/WTlxWfhOPQ https://t.co/aBL7BxumeZ,85,144,19,0
1271296346557841410,Tower Of Time is now available for Digital Pre-order and Pre-download on Xbox One. Save 20% - limited time offer https://t.co/bmJDIM3tp4,136,126,11,0
1271236187999498240,"RT @Xbox: If he knows your name, it’s already too late.

HITMAN 3 is coming to the most powerful console ever. #PowerYourDreams https://t.c…",140,0,1043,0
1271202543486373888,RT @remedygames: We're glad to be able to share that @ControlRemedy will be coming to PlayStation 5 and Xbox Series X. More details coming…,139,0,851,0
1271202438335229952,Two more great titles coming to Xbox Series X! https://t.co/RJVTEv4zwO,70,2795,334,0
1271202006988775424,"RT @aarongreenberg: Congrats to our friends at Sony on their show today. Xbox fans should know titles like GTA V, Resident Evil Village, Hi…",140,0,3372,0
1271169987760119809,RT @KINGDOMHEARTS: KINGDOM HEARTS HD 1.5 + 2.5 ReMIX and KINGDOM HEARTS HD 2.8 Final Chapter Prologue are now available on @XboxGamePass!…,138,0,1389,0
1271150925357309952,Congrats to @XboxP3 ! https://t.co/LyYU9eVsQE https://t.co/WcWjrxWqjv,69,2425,203,0
1271144112582848512,"RT @XboxP3: Thank you, @G4C, we’re honored to be recognized. Gaming has incredible power to mobilize positive change and we’ll continue to…",139,0,197,0
1271134263304269825,Now available on @XboxGamePass &amp; @XboxGamePassPC https://t.co/mRxOyZpwaV,76,1037,125,0
1271095377643442176,"Xbox Live Gold and Xbox Game Pass Ultimate members, play Soulcalibur VI, Tom Clancy’s Rainbow Six Siege, and Dead b… https://t.co/cwriCupqrB",140,467,89,0
1271086939534323712,"RT @businessinsider: When the PlayStation 5 and next-gen Xbox arrive this holiday, major games will be playable across generations for the…",139,0,207,0
1271065095896879105,Xbox (Beta) app on Windows 10 is getting an update and some enhancements. Read all about it here: https://t.co/q9y6SzialQ,121,775,142,0
1270937372444651520,Windbound is now available for Digital Pre-order and Pre-download on Xbox One https://t.co/rUvwBDgfRE,101,307,45,0
1270935453798068224,Beyond Blue (@BeyondBlueGame) from @ELineMedia  is now available for Xbox One https://t.co/yMvPhN5DON,101,318,55,0
1270858878146605056,ICYMI: More games are coming to @XboxGamePass  &amp; @XboxGamePassPC https://t.co/r7V8FSdes8,92,420,41,0
1270835786074615808,Read about how Dirt 5 is optimized for Xbox Series X - plus watch my interview with the games Technical Director… https://t.co/vNlnvqzSXJ,137,685,120,0
1270808687406247937,"In this blog post by @jronald he shares ""Everything You Need to Know about Xbox Series X and The Future of Xbox…So… https://t.co/eswApTein4",139,1053,202,0
1270745385493868545,The Elder Scrolls Online: Greymoor is now available for Xbox One https://t.co/YJGpamPrT1 https://t.co/pmQDgl4NQh,112,312,40,0
1270739046927486977,RT @BangOlufsen: We are excited to announce that we have joined forces with @Xbox to create a new audio proposition catered for the high-en…,140,0,640,0
1270702380200296449,More games coming soon to @XboxGamePass and @XboxGamePassPC. See the full list and dates they'll be added here: https://t.co/hPqyWtrMHf,135,2685,540,0
1270502559178883072,"RT @Polygon: How Xbox Smart Delivery works, and why it will save you money https://t.co/vRPfm1vVgX https://t.co/YQht1H3vAv",122,0,108,0
1270403227842801664,From @WIRED -&gt; Read this interview with @XboxP3 and see why he thinks the future of @Xbox is more than a console… https://t.co/OTkWEtjbtj,140,902,154,0
1269101688608002051,Phil shares how everyone at #TeamXbox feels https://t.co/bbDUS1avds,67,1028,85,0
1267907422275813376,@shanselman @Petrroll @WithinRafael @CharlesGames_cz Hit me up major (at) Xbox -dot-com,87,9,0,0
1267591555658821632,RT @Xbox: We stand together 💙💚 https://t.co/HMZNHeNzLd,54,0,59917,0
1267515695077617670,"RT @Xbox: Xbox stands together with our fans, creators, colleagues, friends, and the entire African American &amp; Black Community against syst…",144,0,4475,0
1266462005591826432,Everyone at Team Xbox is working hard to provide the best gaming experience wherever you want to play 🎮💻☁ 💚 https://t.co/xkfb97Lwja,131,1534,156,0
1266459329957249025,#freecodefridaycontest time. Read this and you could win a code for Xbox Game Pass Ultimate - (6 months). Play over… https://t.co/DdXNkyXAuv,140,2022,654,0
1266445755398582273,Your chance to win a code for Xbox Game Pass Ultimate (6 months) and a couple other prizes for Xbox One happens in… https://t.co/yefahgyGUw,139,1478,241,0
1266399115174273024,"The May 2020 Xbox One Update is available now and delivers a simpler Guide interface, a new Community experience, a… https://t.co/WyZ01hIWaB",140,651,123,0
1266398206025293824,Shantae And The Seven Sirens is now available for Xbox One https://t.co/OI2kDQh89e https://t.co/bNedzUpayO,106,204,31,0
1266395567401209856,Ultimate Fishing Simulator is now available for Xbox One https://t.co/IXxXs3J5aC,80,184,27,0
1266387865832796160,Indiecalypse from @JanduSoft is now available for Xbox One. Save 15% - limited time offer https://t.co/1mPNh8loFH,113,93,10,0
1266384886211809280,Goosebumps Dead Of Night is now available for Digital Pre-order and Pre-download on Xbox One https://t.co/qtZPDpSsO4,116,138,11,0
1266239256613158912,"Borderlands Legendary Collection (@Borderlands) is now available for Xbox One, includes Borderlands: Game of the Ye… https://t.co/4FE0Q7G4fd",140,305,33,0
1266235893406298112,Bug Fables: The Everlasting Sapling from @PaperBugDev and @Dangen_Ent is now available for Xbox One https://t.co/LWDGcKe3tP,123,131,19,0
1266233605686063104,Little Misfortune (@misfortunegame) from @Killmondaygames is now available for Xbox One https://t.co/nyPoROM0KL,111,106,16,0
1266231923208187905,Genetic Disaster from @Team8_Studio and @DrageusG is now available for Xbox One https://t.co/j72RlgQq2o,103,72,11,0
1266227640630837249,Rigid Force Redux is now available for Digital Pre-order and Pre-download on Xbox One https://t.co/WI6uJJB5Dj,109,79,11,0
1266224152916049920,Warborn is now available for Digital Pre-order and Pre-download on Xbox One. Save 20% - limited time offer https://t.co/97poqUdqTb,130,94,13,0
1266222018921328641,Outbuddies DX is now available for Digital Pre-order and Pre-download on Xbox One https://t.co/4CfLHfWSxZ,105,74,9,0
1266081319131287552,Evan’s Remains is now available for Digital Pre-order and Pre-download on Xbox One https://t.co/qgz7X1ulUp https://t.co/0CP6RRCxEl,130,150,21,0
1266063191554977793,More details on Xbox Series X back compat https://t.co/XqeLtgDhXw,65,1949,242,0
1266025980193374211,Atomicrops (@Atomicrops) is now available for Xbox One https://t.co/UNJkl66GMo,78,96,13,0
1266021553273139202,"Xbox Live Gold and Xbox Game Pass Ultimate members, play Jump Force, Hunt: Showdown, and Stellaris: Console Edition… https://t.co/1IS0SNWskX",140,270,53,0
1266021185004830720,Disintegration is available for Digital Pre-order and Pre-download on Xbox One https://t.co/dnIkapwKIB https://t.co/2AsV57h2Ua,126,181,34,0
1265991323502309376,"Read about the future of Backwards Compatibility on Xbox Series X from @jronald, Director of Program Management for… https://t.co/vpV4ywi4fp",140,1366,261,0
1265864795573501953,Those Who Remain (@ThoseWhoRemain) from @MrCamel101 and @WiredP is now available for Xbox One https://t.co/tVhLHFHz5r,117,274,48,0
1265863077058064385,Georifters (@georifters) from @busytoaster is now available for Xbox One https://t.co/0YUtCMQApI,96,83,14,0
1265862070416732165,Let’s Sing 2020 is now available for Xbox One https://t.co/u8L4UWbqxA,69,135,20,0
1265861909129031680,Woodle Tree Bundle is now available for Xbox One https://t.co/sbtTeD45rO,72,82,11,0
1265797250149572608,ICYMI: You can now watch @hbomax on Xbox One 📺🎮 https://t.co/PJiFdpitJl,71,400,49,0
1265691995927769088,RT @XboxWire: The Xbox Family Settings app is now available in Preview. Join today to help manage your child’s gaming on #Xbox right from y…,140,0,139,0
1265351621636009984,Asterix &amp; Obelix XXL 3 – DEMO is now available for Xbox One. Download it here: https://t.co/XuQeWRPznc,106,194,22,0
1265345623080886272,"Mortal Kombat 11: Aftermath is available for Xbox One, or grab the Mortal Kombat 11: Aftermath Kollection and get t… https://t.co/qcOiMgg2PR",140,232,30,0
1265340879411138560,Apex Legends - Pathfinder Edition is now available for Xbox One https://t.co/fzglFlcULF https://t.co/s1Lw14sV69,111,259,21,0
1265299398629617664,Warface: Breakout (@PlayBreakout) is now available for Xbox One and has two editions to choose from… https://t.co/5vbbSOTSSG,124,187,29,0
1265296720830685186,"Xbox Live Gold and Xbox Game Pass Ultimate members, download Shantae and the Pirate’s Curse and Destroy All Humans!… https://t.co/mhWQ5h7PpD",140,2073,449,0
1265191766791122944,"Minecraft Dungeons (@dungeonsgame) is now available for Xbox One and Windows 10, plus it's included in… https://t.co/kmkS4GN52R",127,1788,286,0
1264232488731176961,"RT @Xbox: Ray Tracing                 Xbox Series X
                           🤝
          Holy Grail of Graphics 
               https://t…",140,0,2678,0
1263932166775308288,Ending another busy week with the latest episode of This Week On Xbox. To all the devs/pubs/games that launched or… https://t.co/ockkPdsYbQ,139,201,19,0
1263926321727430657,"Call of Duty Modern Warfare - C.O.D.E. Fearless Pack is now available for Xbox One, includes an Operator, Assault R… https://t.co/41yggr24or",140,180,22,0
1263892654590312448,"Each #freecodefridaycontest winner is also getting a code for Maneater (@maneatergame), now available for Xbox One https://t.co/aBDLa2kmQu",138,431,80,0
1263878751999242240,Your chance to win a code for Saints Row The Third Remastered and a couple other prizes on Xbox One happens in one… https://t.co/pIVjiUOf8B,139,942,152,0
1263840279930351619,Great to see @XboxGamePass members enjoying @DayZ as much as we do. We’ll see the hundreds of thousands of you onli… https://t.co/wBlyGIl85d,140,609,55,0
1263693332380741632,Saints Row The Third Remastered (@SaintsRow) is now available for Xbox One https://t.co/FzTEzH9s4s,98,941,140,0
1263691338177900545,Monstrum from @TeamJunkfish and @SOEDESCO is now available for Xbox One https://t.co/dM6XyQ4SHH,95,137,16,0
1263689468411695106,The Taller I Grow from @noobles_studio is now available for Xbox One and Windows 10 (Xbox Play Anywhere) https://t.co/WFBMs9VUTs,128,89,12,0
1263686321572179968,Genetic Disaster is now available for Digital Pre-order and Pre-download on Xbox One https://t.co/8M08Tvk6Ia,108,104,12,0
1263670570119360514,Project Warlock is now available for Digital Pre-order and Pre-download on Xbox One https://t.co/NPePHYsoqX,107,224,27,0
1263641784489410561,We Were Here Together is now available for Digital Pre-order and Pre-download on Xbox One https://t.co/PpRBOV5GSx,113,169,25,0
1263638525490032640,Maneater from @TripwireInt is now available for Xbox One https://t.co/lHMCWWgJ1j https://t.co/xQ6gwaScS0,104,250,40,0
1263632473373544448,ICYMI: The @XboxGamePass library is growing again! https://t.co/3rReJGJe9j,74,307,26,0
1263593880349360129,"Check out @ID_Xbox Game Fest - where we are spotlighting creators, stories, and new ways to play with many ID games… https://t.co/gc9OKTc7fo",140,288,41,0
1263511858192904192,RT @XboxWire: Microsoft and @SpecialOlympics are teaming up for the 2020 Special Olympics Xbox Virtual Gaming Event featuring Forza Motorsp…,140,0,73,0
1263508582806327296,"The New Frontier Pass for Sid Meier's Civilization VI is now available for Xbox One, features eight new civilizatio… https://t.co/NoUVcZXgvT",140,136,19,0
1263508382402490372,Hunting Simulator 2 (@HuntingSim) is now available for Digital Pre-order and Pre-download on Xbox One and has two e… https://t.co/xGn0bZORXJ,140,118,15,0
1263499406868795392,"RT @GroundedTheGame: 🚨 NEWS ALERT 🚨

Grounded will release its Xbox Insider flight AND participate in the Steam Game Festival on June 9th!…",139,0,213,0
1263484740578840576,"Huge shout out &amp; thank you to each and every @XboxGamePass member! 💚🎮 You all made this possible 
",125,4227,549,0
1263462161046622208,"And for the PC gamers, more games coming soon to @XboxGamePassPC. See the details here: https://t.co/nNpl5Ooz92",111,306,31,0
1263454600520056837,More games coming soon to @XboxGamePass. See the list and dates they'll be added here: https://t.co/PtwSX6PrQp,110,1568,256,0
1263315350587764736,The Persistence (@PlayPersistence) from @FireSpriteGames is now available for Xbox One https://t.co/Dok678RmdX,110,234,31,0
1263145624419004416,Depth Of Extinction (@depthextinction) is now available for Digital Pre-order and Pre-download on Xbox One. Save 10… https://t.co/eVn3xseXV3,140,112,21,0
1263145142757670912,Shaolin vs Wutang is now available for Xbox One https://t.co/fxsVP8IIaG,71,429,107,0
1262919034330320896,Concept Destruction from @Thinicegames and @RatalaikaGames is now available for Xbox One. Save 20% - limited time o… https://t.co/2yU7YXVUH5,140,162,27,0
1262869140475273217,"The @ID_Xbox Game Fest Sale is going on now with savings up to 75% off on some great titles, including Firewatch fo… https://t.co/kLjcG7QoIt",140,462,86,0
1262865567288967171,A new perk is now available for @XboxGamePass Ultimate members: claim your World of Warships - German Steel pack fo… https://t.co/RYCoJGcuRX,140,679,112,0
1262803051103965185,Mafia II &amp; Mafia III: Definitive Editions (@mafiagame) are now available for Xbox One; Mafia: Definitive Edition is… https://t.co/9unB4T5P8y,144,488,97,0
1262767575638790144,Congratulations! One of the best games of the current generation is 5 today AND available on @XboxGamePass… https://t.co/q7DuLpb3Pc,131,930,87,0
1262605872213004291,A Fold Apart from @LRGthunder is now available for Xbox One https://t.co/cACcSjnuh9,83,92,14,0
1262600797814050817,Golf With Your Friends (@GolfWYF) is now available for Xbox One and included in @XboxGamePass https://t.co/afHEP0yXdv,117,895,133,0
1262598298067591168,Georifters (@georifters) is now available for Digital Pre-order and Pre-download on Xbox One. Save 20% - limited ti… https://t.co/NmuPN9CARl,140,80,12,0
1262565161182720000,@ChrisCovent @jeffrubenstein @XboxP3 Congrats!,46,63,2,0
1262424741148651522,The LEGO Games Bundle is now available for Xbox One and includes four LEGO games from @TTGames and @wbgames https://t.co/QRA84Mdeb9,131,279,54,0
1261419594918424577,"Here is the latest episode of This Week On Xbox. Wherever you are and whatever you're playing this weekend, have fu… https://t.co/F46JRqTszz",140,243,36,0
1261418871715532800,"Download The LEGO NINJAGO Movie Video Game on Xbox One https://t.co/5C08i4JZpY for free until 21 May, thanks to… https://t.co/3pm6cIg95I",136,516,116,0
1261418626327785474,"Congrats to @Dano1984, @Nimbostratus73, @CasualCasualty, @timshrimp and @H2oDAG – they each won a code for Xbox Gam… https://t.co/xEXGkgdaJ9",140,298,6,0
1261385956709380096,#freecodefridaycontest time. Read this and you could win a code for Xbox Game Pass Ultimate (6 months). Play Halo 2… https://t.co/j1E2iROkBG,140,2123,596,0
1261371192335724545,Your chance to win a code for Xbox Game Pass Ultimate (6 months) happens in one hour with #freecodefridaycontest,112,1242,193,0
1261332740919549952,"REMINDER: If you have Xbox Live Gold or Xbox Game Pass Ultimate, today is the last day to grab Knights of Pen and P… https://t.co/MGWRHewPT1",140,449,72,0
1261326532837961729,PGA TOUR 2K21 (@PGATOUR2K) is now available for Digital Pre-order and Pre-download on Xbox One and has two editions… https://t.co/Q3N5QLFU0y,140,176,24,0
1261326094612881409,EMMA: Lost In Memories from @SandBloomStudio and @JanduSoft is now available for Xbox One https://t.co/nIOhAAkRjm,113,96,17,0
1261151261220466688,Little Misfortune (@misfortunegame) is now available for Digital Pre-order and Pre-download on Xbox One https://t.co/oxssSH1S0F,127,163,20,0
