id,text,len tweet,likes,rt,position
1271421448842653696,Anuncia AMLO nueva gira para la próxima semana; acudirá a 5 estados https://t.co/dZoOZIIehn https://t.co/CCnERYCMr4,115,6,7,0
1271419480942362624,"Tarde se le hacía para acusar, injustamente para variar, al presidente Andrés Manuel López Obrador de haber realiza… https://t.co/l3FLE94t2u",140,44,24,0
1271389281269891073,"#EnPortada Prepara la 4T golpe a empresas ferroviarias 
",103,23,25,0
1271351532781481985,"Bárbara de Regil es conocida por dar vida a ""Rosario Tijeras"". Pero, para los usuarios de redes sociales ha protago… https://t.co/lItGOWF4TJ",140,15,1,0
