id,text,len tweet,likes,rt,position
1068938924238659584,Deseo de todo corazón que le vaya bien a México y al nuevo Presidente @lopezobrador_. La oposición debe cumplir con… https://t.co/FC0DTB4GMh,140,21759,3826,-1
1011060133810454529,"Con la fuerza de los veracruzanos, vamos a cambiar a #México y a recuperar la paz. El próximo domingo, a esta hora,… https://t.co/XcV5Bh4tnU",140,1646,648,0
1007682269429940224,"López Obrador no es cambio, es todo lo contrario. Darle contratos a sus amigos de manera directa, se llama corrupci… https://t.co/UyEZXiRSWz",140,5386,2672,-1
1006814494507618304,López Obrador se ha convertido en lo que tanto ha criticado. Aquí están los documentos que prueban que favoreció a… https://t.co/O8qF7hqbU7,139,9525,4538,-1
1006741583574679552,"Le pregunto a López Obrador: ¿cambio es tu pacto con Elba Esther Gordilo, Bartlett y tu nuevo pacto con Enrique Peñ… https://t.co/CrACBoUNr1",140,4408,2006,-1
1006734874600882176,"López Obrador, contesta sin chistes y sin payasadas: ¿a Rioboó se le otorgaron contratos de manera directa por 170… https://t.co/ng0b4vZtND",139,6699,2888,-1
1006734575022702593,"Aquí se ve a López Obrador con su amigo, el ingeniero Rioboó, quien participó en el proyecto de las pistas del Nuev… https://t.co/R91VhfIhvp",140,2646,1717,-1
1006733349996584960,En https://t.co/nTzXwzrcE6 van a encontrar las pruebas de que López Obrador le dio contratos de manera directa por… https://t.co/3gLE3excBQ,139,2890,1750,-1
1006728975517810690,López Obrador miente. Esta es la votación del Congreso para aumentar el precio de la gasolina con fecha del 17 de o… https://t.co/nJ4pu8Tz2U,140,4532,2460,-1
